{
  "schema_version": 1,
  "synthetic": true,
  "revision": "syn-edge-null-01",
  "ledger": {
    "path": "evidence.json",
    "sha256": "68b3fb0520c91caf87b2700f95011e3ef258c0c98612d62b5beb3c76e6732517"
  },
  "campaign": {
    "id": "standards-demo-01",
    "context_revision": "camp-r1",
    "assets": [
      {
        "id": "demo-01",
        "revision": "v1",
        "channel": "github"
      }
    ],
    "acquisition_window": {
      "start": "2026-09-01T00:00:00Z",
      "end": "2026-10-01T00:00:00Z"
    },
    "cost_window": {
      "start": "2026-09-01T00:00:00Z",
      "end": "2026-10-01T00:00:00Z"
    },
    "owner": "campaign-owner",
    "state": "prepared",
    "authorization": null
  },
  "cohort": null,
  "investment": null,
  "sources": [
    {
      "ref": {
        "id": "SRC-001",
        "revision": "r1"
      },
      "path": "fixtures/synthetic-cohort-source.json",
      "sha256": "163c0a827e7be8cfac5d3a0a72b9302f6d10c1a6515a1ce3a0a88527ed7b85ed"
    }
  ],
  "metric_bindings": {
    "activation": {
      "id": "MET-001",
      "revision": "r1"
    },
    "repeat_rate": {
      "id": "MET-002",
      "revision": "r1"
    },
    "cash_per_activation": {
      "id": "MET-003",
      "revision": "r1"
    },
    "cash_per_repeat": {
      "id": "MET-004",
      "revision": "r1"
    },
    "hours_per_repeat": {
      "id": "MET-005",
      "revision": "r1"
    }
  },
  "limitations": [
    "Null cohort edge fixture."
  ],
  "cost_mapping": null,
  "public_projection": {
    "campaign_id": "standards-demo-01",
    "input_revision": "syn-edge-null-01",
    "source_aliases": [
      {
        "ref": {
          "id": "SRC-001",
          "revision": "r1"
        },
        "alias": "cohort-origin"
      }
    ]
  }
}
